{
  "$schema": "./iconMenuConfig.schema.json",
  "version": "1.0.0",
  "description": "Configuration for the icons menu organization",
  "categories": [
    {
      "id": "pixotope-systems",
      "name": "Pixotope Systems",
      "description": "Core Pixotope system components",
      "color": "#FF6B35",
      "isExpanded": true,
      "order": 1,
      "icons": [
        {
          "id": "pixotope-graphics-compute",
          "name": "Pixotope Graphics Compute",
          "collection": "PIXOTOPE",
          "existingIconId": "server",
          "fallbackIcon": "server",
          "description": "High-performance graphics processing unit for real-time rendering"
        },
        {
          "id": "pixotope-tracking-compute",
          "name": "Pixotope Tracking Compute",
          "collection": "PIXOTOPE",
          "existingIconId": "server",
          "fallbackIcon": "server",
          "description": "Dedicated tracking computation server"
        },
        {
          "id": "pixotope-control-director",
          "name": "Pixotope Control/Director Station",
          "collection": "PIXOTOPE",
          "existingIconId": "desktop",
          "fallbackIcon": "desktop",
          "description": "Central control station for directing virtual production"
        },
        {
          "id": "pixotope-server",
          "name": "Pixotope Server",
          "collection": "PIXOTOPE",
          "existingIconId": "server",
          "fallbackIcon": "server",
          "description": "Main Pixotope application server"
        }
      ]
    },
    {
      "id": "tracking-hardware",
      "name": "Tracking Hardware",
      "description": "Camera and lens tracking equipment",
      "color": "#4ECDC4",
      "isExpanded": false,
      "order": 2,
      "icons": [
        {
          "id": "camera-tracking-sensor",
          "name": "Camera Tracking Sensor/Head",
          "collection": "PIXOTOPE",
          "existingIconId": "pixotope-video",
          "fallbackIcon": "cube",
          "description": "Camera-mounted tracking sensor for position detection"
        },
        {
          "id": "lens-encoder",
          "name": "Lens Encoder",
          "collection": "PIXOTOPE",
          "existingIconId": "cube",
          "fallbackIcon": "cube",
          "description": "Lens parameter encoder for focus, zoom, and iris tracking"
        }
      ]
    },
    {
      "id": "video-infrastructure",
      "name": "Video Infrastructure",
      "description": "Video routing, switching, and processing equipment",
      "color": "#45B7D1",
      "isExpanded": false,
      "order": 3,
      "icons": [
        {
          "id": "video-router-matrix",
          "name": "Video Router/Matrix",
          "collection": "PIXOTOPE",
          "existingIconId": "router",
          "fallbackIcon": "router",
          "description": "Video signal routing and switching matrix"
        },
        {
          "id": "video-switcher",
          "name": "Video Switcher",
          "collection": "PIXOTOPE",
          "existingIconId": "pixotope-mixer",
          "fallbackIcon": "switch-module",
          "description": "Live video production switcher"
        },
        {
          "id": "multi-viewer",
          "name": "Multi-viewer",
          "collection": "PIXOTOPE",
          "existingIconId": "desktop",
          "fallbackIcon": "desktop",
          "description": "Multiple video source monitoring display"
        },
        {
          "id": "video-converter",
          "name": "Video Converter",
          "collection": "PIXOTOPE",
          "existingIconId": "cube",
          "fallbackIcon": "cube",
          "description": "Video format and standard converter"
        },
        {
          "id": "ip-video-gateway",
          "name": "IP Video Gateway",
          "collection": "PIXOTOPE",
          "existingIconId": "router",
          "fallbackIcon": "router",
          "description": "IP-based video transport gateway"
        }
      ]
    },
    {
      "id": "network-infrastructure",
      "name": "Network Infrastructure",
      "description": "Network equipment and timing systems",
      "color": "#96CEB4",
      "isExpanded": false,
      "order": 4,
      "icons": [
        {
          "id": "network-switch",
          "name": "Network Switch",
          "collection": "PIXOTOPE",
          "existingIconId": "switch-module",
          "fallbackIcon": "switch-module",
          "description": "Ethernet network switching equipment"
        },
        {
          "id": "network-router",
          "name": "Network Router (Ethernet/WiFi)",
          "collection": "PIXOTOPE",
          "existingIconId": "router",
          "fallbackIcon": "router",
          "description": "Network routing for Ethernet and wireless connectivity"
        },
        {
          "id": "ptp-grandmaster-clock",
          "name": "PTP Grandmaster Clock",
          "collection": "PIXOTOPE",
          "existingIconId": "pixotope-clock",
          "fallbackIcon": "cube",
          "description": "Precision Time Protocol master clock for network synchronization"
        },
        {
          "id": "firewall",
          "name": "Firewall",
          "collection": "PIXOTOPE",
          "existingIconId": "firewall",
          "fallbackIcon": "firewall",
          "description": "Network security firewall appliance"
        }
      ]
    },
    {
      "id": "cameras-capture",
      "name": "Cameras & Capture",
      "description": "Camera systems and capture equipment",
      "color": "#FFEAA7",
      "isExpanded": false,
      "order": 5,
      "icons": [
        {
          "id": "broadcast-cinema-camera",
          "name": "Broadcast/Cinema Camera",
          "collection": "PIXOTOPE",
          "existingIconId": "pixotope-video",
          "fallbackIcon": "cube",
          "description": "Professional broadcast or cinema camera"
        },
        {
          "id": "ptz-robotic-camera",
          "name": "PTZ/Robotic Camera",
          "collection": "PIXOTOPE",
          "existingIconId": "pixotope-video",
          "fallbackIcon": "cube",
          "description": "Pan-tilt-zoom or robotic camera system"
        },
        {
          "id": "camera-ccu",
          "name": "Camera CCU",
          "collection": "PIXOTOPE",
          "existingIconId": "cube",
          "fallbackIcon": "cube",
          "description": "Camera Control Unit for remote camera operation"
        },
        {
          "id": "witness-camera",
          "name": "Witness Camera",
          "collection": "PIXOTOPE",
          "existingIconId": "pixotope-video",
          "fallbackIcon": "cube",
          "description": "Reference camera for tracking and calibration"
        }
      ]
    },
    {
      "id": "display-systems",
      "name": "Display Systems",
      "description": "LED walls, screens, and display equipment",
      "color": "#DDA0DD",
      "isExpanded": false,
      "order": 6,
      "icons": [
        {
          "id": "led-wall",
          "name": "LED Wall",
          "collection": "PIXOTOPE",
          "existingIconId": "pixotope-led-wall",
          "fallbackIcon": "desktop",
          "description": "Large LED video wall display"
        },
        {
          "id": "led-floor",
          "name": "LED Floor",
          "collection": "PIXOTOPE",
          "existingIconId": "pixotope-led-floor",
          "fallbackIcon": "cube",
          "description": "LED floor panel display system"
        },
        {
          "id": "led-processor",
          "name": "LED Processor",
          "collection": "PIXOTOPE",
          "existingIconId": "cube",
          "fallbackIcon": "cube",
          "description": "LED display processing and control unit"
        },
        {
          "id": "chroma-screen",
          "name": "Chroma Screen",
          "collection": "PIXOTOPE",
          "existingIconId": "pixotope-greenscreen",
          "fallbackIcon": "cube",
          "description": "Green/blue screen for chroma keying"
        },
        {
          "id": "video-projector",
          "name": "Video Projector",
          "collection": "PIXOTOPE",
          "existingIconId": "cube",
          "fallbackIcon": "cube",
          "description": "Video projection system"
        },
        {
          "id": "monitor",
          "name": "Monitor",
          "collection": "PIXOTOPE",
          "existingIconId": "desktop",
          "fallbackIcon": "desktop",
          "description": "Professional video monitor"
        }
      ]
    },
    {
      "id": "sync-timing",
      "name": "Sync & Timing",
      "description": "Synchronization and timing equipment",
      "color": "#FDA7DF",
      "isExpanded": false,
      "order": 7,
      "icons": [
        {
          "id": "sync-generator",
          "name": "Sync Generator",
          "collection": "PIXOTOPE",
          "existingIconId": "pixotope-clock",
          "fallbackIcon": "cube",
          "description": "Video synchronization signal generator"
        },
        {
          "id": "timecode-generator",
          "name": "Timecode Generator",
          "collection": "PIXOTOPE",
          "existingIconId": "pixotope-clock",
          "fallbackIcon": "cube",
          "description": "SMPTE timecode generation device"
        }
      ]
    },
    {
      "id": "control-automation",
      "name": "Control & Automation",
      "description": "Control systems and automation equipment",
      "color": "#74B9FF",
      "isExpanded": false,
      "order": 8,
      "icons": [
        {
          "id": "automation-controller",
          "name": "Automation Controller",
          "collection": "PIXOTOPE",
          "existingIconId": "cube",
          "fallbackIcon": "cube",
          "description": "Production automation control system"
        },
        {
          "id": "nrcs-mos-server",
          "name": "NRCS/MOS Server",
          "collection": "PIXOTOPE",
          "existingIconId": "server",
          "fallbackIcon": "server",